{
  "schemaVersion": "1.0.0",
  "catalogLibraryId": "cx507-china-reference-library-v2",
  "reviewer": "codex_visual_review",
  "reviewedAtUtc": "2026-07-22T12:00:00Z",
  "policy": "Keep only visually reviewed Chinese historic architecture, gardens, ruins, or construction details with no visible people; quarantine modern, overseas, model, exhibit, artifact-only, watermarked, irrelevant, or low-quality images.",
  "expectedArchitectureAssets": 381,
  "architectureOrderSha256": "b4cee1b0c7757080f41ba99668329bb493c1efb198ae34881a33ae7de3f38ee1",
  "quarantineUnlisted": true,
  "confirmedAbsentIndices": [
    1, 2, 4, 9, 14, 16, 17, 18, 21, 23, 28, 31,
    35, 37, 43, 48, 52, 55, 63, 64, 65, 68, 69, 70,
    71, 76, 78, 80, 93, 94, 97, 109, 111, 114, 115, 122,
    126, 134, 135, 137, 140, 151, 152, 155, 156, 161, 162, 163,
    166, 167, 169, 172, 180, 182, 184, 185, 186, 188, 189, 190,
    191, 192, 193, 196, 225, 228, 231, 232, 234, 235, 236, 238,
    245, 252, 254, 255, 256, 264, 267, 268, 271, 274, 275, 276,
    279, 284, 285, 291, 293, 295, 297, 298, 301, 303, 313, 314,
    315, 316, 317, 319, 320, 326, 328, 330, 331, 332, 333, 334,
    335, 336, 337, 339, 350, 356, 357, 358, 362, 363, 365, 366,
    370, 374
  ],
  "reviewedContactSheets": [
    { "fileName": "architecture-all-01.jpg", "sha256": "42df67aa7b9cdb20bf42a29ec12822f374df2c413f6d3b847dd2b97292248469" },
    { "fileName": "architecture-all-02.jpg", "sha256": "9152f25976f957be3bd25eda95c425f08c606132b136870bb9859cc37aadcc4a" },
    { "fileName": "architecture-all-03.jpg", "sha256": "5a3f8efd3b6e26ff759e644d1b81507789b303798ef232caad56435ea0bb23b0" },
    { "fileName": "architecture-all-04.jpg", "sha256": "60e26b4ca04d5724cdaa555d196f2ffb16ef36e3f67972c877fe39e75bc6017e" },
    { "fileName": "architecture-all-05.jpg", "sha256": "52a0191fa2679f85691c53d1d525137bd4dbef453421b25a698bcec13ef59b57" },
    { "fileName": "architecture-all-06.jpg", "sha256": "fa0c99907b435e393891ec86c091ccfa2e9db4566f1f04d3c465cc757df48b5f" },
    { "fileName": "architecture-all-07.jpg", "sha256": "ac3c9c6edbf05a37b17b68aee136db6b9508314609362789ca633a102c1efa3e" },
    { "fileName": "architecture-all-08.jpg", "sha256": "d143aaea78353fb82db303c84ae0ad9feca638d1f961cbc4fd893eee22bffb7c" },
    { "fileName": "architecture-all-09.jpg", "sha256": "50155119891ed68dce822c0f049180f579179484c1f62d0ea47904c5de1214a5" },
    { "fileName": "architecture-all-10.jpg", "sha256": "8fde31b32bbbb72e7b24d3c4f92d8aa4901aed8228a09e26fe1fa063b08a0acf" },
    { "fileName": "architecture-all-11.jpg", "sha256": "2637d633faecdad66f3a6639efd6cc5f829b8b34fad6513d482e09c2f00e476f" },
    { "fileName": "architecture-all-12.jpg", "sha256": "87c885a8ebc6a5e5336470e10b8368c9dc2b2be7bff93d4abfab3d7c112265bc" },
    { "fileName": "architecture-all-13.jpg", "sha256": "516aa8af81ea9fa0107107008c8a58546ca260e37b52c9ab834cbec81df2250e" },
    { "fileName": "architecture-all-14.jpg", "sha256": "ce90823754f1dbb66adc07e51a56c13c16507ed658234f7200f430578499ea5f" },
    { "fileName": "architecture-all-15.jpg", "sha256": "607f15e226b9f3ab76eff80e35e349d461935309b82eeb279a4bacb8a9fdfb6b" },
    { "fileName": "architecture-all-16.jpg", "sha256": "e3d83b3f64af3b1b596671e56a95f70d074f51e1065ba8e641f52c6fa5c1299a" },
    { "fileName": "architecture-all-17.jpg", "sha256": "638811ad95a26e878ae1457a9f9de938ab34249a97bc82483591da75e26296ce" },
    { "fileName": "architecture-all-18.jpg", "sha256": "915323b2f1064db8b8f81d2f1675f932651d2a88f4b8539d1100e752dce8e2b7" },
    { "fileName": "architecture-all-19.jpg", "sha256": "3095f3975299a73c8af8189c2226c04b1af3d2cb66be19e33b31789b1ebc12d8" },
    { "fileName": "architecture-all-20.jpg", "sha256": "11f911a1fc9355b53017ffbf331a4185015661945ded4c0279e5e0c7cc5907c4" },
    { "fileName": "architecture-all-21.jpg", "sha256": "e56ceb4de02a12d05b27ef173f3a7f469df338940409f845d7f631bc8bd1612b" },
    { "fileName": "architecture-all-22.jpg", "sha256": "99f23c599c56df6707e823079a2d0d5a138e792ee5486710bcd06e94b414280e" },
    { "fileName": "architecture-all-23.jpg", "sha256": "bc083c39f6f6b012527e86330d6799013ca6c700240e36598b9f63b8598e4f43" },
    { "fileName": "architecture-all-24.jpg", "sha256": "66691228f87c4973ba632906481501a5ea7cc6039d0ed09241dbc724e2e25624" }
  ]
}
